{"$schema":"https://json-schema.org/draft/2020-12/schema","$id":"https://catalog.local/schemas/v1/category-mapping.schema.json","title":"category-mapping","type":"object","additionalProperties":false,"required":["schema_version","mapping_id","source_category_key","source_category_name","source_category_path","source_evidence","target_root_key","target_category_key","mapping_status","mapping_rule","primary","additional_source_categories","approval_reference","policy_fingerprint","review_references","notes"],"properties":{"schema_version":{"const":"1.0.0"},"mapping_id":{"type":"string"},"source_category_key":{"type":"string"},"source_category_name":{"type":"string"},"source_category_path":{"type":"string"},"source_evidence":{"type":"array"},"target_root_key":{"type":["string","null"]},"target_category_key":{"type":["string","null"]},"mapping_status":{"enum":["proposed","approved","rejected","manual_review_required","unsupported_target","target_missing"]},"mapping_rule":{"type":"string"},"primary":{"type":"boolean"},"additional_source_categories":{"type":"array"},"approval_reference":{"type":["string","null"]},"policy_fingerprint":{"type":"string"},"review_references":{"type":"array"},"notes":{"type":"string"}}}
