{"schema_version":"1.0.0","mapping_id":"map-synthetic","source_category_key":"forklifts","source_category_name":"Synthetic forklifts","source_category_path":"equipment/forklifts","source_evidence":["e-1"],"target_root_key":"machinery","target_category_key":"forklifts","mapping_status":"proposed","mapping_rule":"explicit-human-matrix-v1","primary":true,"additional_source_categories":[],"approval_reference":null,"policy_fingerprint":"aaaaaaaaaaaaaaaaaaaaaaaaaaaaaaaaaaaaaaaaaaaaaaaaaaaaaaaaaaaaaaaa","review_references":[],"notes":"Synthetic proposal only"}
